slug,url_path,meta_title,meta_desc,h1,industry_name,typical_roles,main_challenge,page_type
hiring-software-for-healthcare,/hiring-software-for-healthcare/,Hiring Software for Healthcare | SmoothHiring,"SmoothHiring helps healthcare businesses hire nurses, doctors, medical staff faster. Solve credential verification and compliance with AI-powered recruitment.",Smarter Hiring Software for Healthcare,Healthcare,"nurses, doctors, medical staff",credential verification and compliance,Industry
hiring-software-for-retail,/hiring-software-for-retail/,Hiring Software for Retail | SmoothHiring,"SmoothHiring helps retail businesses hire sales associates, managers, cashiers faster. Solve high-volume seasonal hiring with AI-powered recruitment.",Smarter Hiring Software for Retail,Retail,"sales associates, managers, cashiers",high-volume seasonal hiring,Industry
hiring-software-for-technology,/hiring-software-for-technology/,Hiring Software for Technology | SmoothHiring,"SmoothHiring helps technology businesses hire developers, engineers, product managers faster. Solve technical skill assessment at scale with AI-powered recruitment.",Smarter Hiring Software for Technology,Technology,"developers, engineers, product managers",technical skill assessment at scale,Industry
hiring-software-for-restaurants,/hiring-software-for-restaurants/,Hiring Software for Restaurants | SmoothHiring,"SmoothHiring helps restaurants businesses hire chefs, servers, kitchen staff faster. Solve fast turnaround and high turnover with AI-powered recruitment.",Smarter Hiring Software for Restaurants,Restaurants,"chefs, servers, kitchen staff",fast turnaround and high turnover,Industry
hiring-software-for-construction,/hiring-software-for-construction/,Hiring Software for Construction | SmoothHiring,"SmoothHiring helps construction businesses hire contractors, project managers, laborers faster. Solve safety certification tracking with AI-powered recruitment.",Smarter Hiring Software for Construction,Construction,"contractors, project managers, laborers",safety certification tracking,Industry
hiring-software-for-education,/hiring-software-for-education/,Hiring Software for Education | SmoothHiring,"SmoothHiring helps education businesses hire teachers, administrators, counselors faster. Solve background checks and credentials with AI-powered recruitment.",Smarter Hiring Software for Education,Education,"teachers, administrators, counselors",background checks and credentials,Industry
hiring-software-for-logistics,/hiring-software-for-logistics/,Hiring Software for Logistics | SmoothHiring,"SmoothHiring helps logistics businesses hire drivers, warehouse staff, dispatchers faster. Solve license and compliance verification with AI-powered recruitment.",Smarter Hiring Software for Logistics,Logistics,"drivers, warehouse staff, dispatchers",license and compliance verification,Industry
hiring-software-for-finance,/hiring-software-for-finance/,Hiring Software for Finance | SmoothHiring,"SmoothHiring helps finance businesses hire analysts, advisors, accountants faster. Solve regulatory compliance in hiring with AI-powered recruitment.",Smarter Hiring Software for Finance,Finance,"analysts, advisors, accountants",regulatory compliance in hiring,Industry
hiring-software-for-manufacturing,/hiring-software-for-manufacturing/,Hiring Software for Manufacturing | SmoothHiring,"SmoothHiring helps manufacturing businesses hire operators, technicians, quality control faster. Solve skills-based hiring at volume with AI-powered recruitment.",Smarter Hiring Software for Manufacturing,Manufacturing,"operators, technicians, quality control",skills-based hiring at volume,Industry
hiring-software-for-real-estate,/hiring-software-for-real-estate/,Hiring Software for Real Estate | SmoothHiring,"SmoothHiring helps real estate businesses hire agents, brokers, property managers faster. Solve licensing verification with AI-powered recruitment.",Smarter Hiring Software for Real Estate,Real Estate,"agents, brokers, property managers",licensing verification,Industry
hiring-software-for-hospitality,/hiring-software-for-hospitality/,Hiring Software for Hospitality | SmoothHiring,"SmoothHiring helps hospitality businesses hire hotel staff, managers, concierge faster. Solve seasonal and high-volume hiring with AI-powered recruitment.",Smarter Hiring Software for Hospitality,Hospitality,"hotel staff, managers, concierge",seasonal and high-volume hiring,Industry
hiring-software-for-legal,/hiring-software-for-legal/,Hiring Software for Legal | SmoothHiring,"SmoothHiring helps legal businesses hire attorneys, paralegals, legal assistants faster. Solve bar certification and compliance with AI-powered recruitment.",Smarter Hiring Software for Legal,Legal,"attorneys, paralegals, legal assistants",bar certification and compliance,Industry
hiring-software-for-nonprofit,/hiring-software-for-nonprofit/,Hiring Software for Nonprofits | SmoothHiring,"SmoothHiring helps nonprofits businesses hire program managers, coordinators, staff faster. Solve hiring within tight budgets with AI-powered recruitment.",Smarter Hiring Software for Nonprofits,Nonprofits,"program managers, coordinators, staff",hiring within tight budgets,Industry
hiring-software-for-staffing,/hiring-software-for-staffing/,Hiring Software for Staffing Agencies | SmoothHiring,SmoothHiring helps staffing agencies businesses hire temporary and contract workers faster. Solve rapid placement at high volume with AI-powered recruitment.,Smarter Hiring Software for Staffing Agencies,Staffing Agencies,temporary and contract workers,rapid placement at high volume,Industry
hiring-software-for-insurance,/hiring-software-for-insurance/,Hiring Software for Insurance | SmoothHiring,"SmoothHiring helps insurance businesses hire agents, underwriters, claims adjusters faster. Solve license and compliance tracking with AI-powered recruitment.",Smarter Hiring Software for Insurance,Insurance,"agents, underwriters, claims adjusters",license and compliance tracking,Industry
hiring-software-for-marketing,/hiring-software-for-marketing/,Hiring Software for Marketing Agencies | SmoothHiring,"SmoothHiring helps marketing agencies businesses hire designers, copywriters, strategists faster. Solve portfolio and skill assessment with AI-powered recruitment.",Smarter Hiring Software for Marketing Agencies,Marketing Agencies,"designers, copywriters, strategists",portfolio and skill assessment,Industry
hiring-software-for-call-center,/hiring-software-for-call-center/,Hiring Software for Call Centers | SmoothHiring,"SmoothHiring helps call centers businesses hire agents, supervisors, quality analysts faster. Solve personality fit and communication skills with AI-powered recruitment.",Smarter Hiring Software for Call Centers,Call Centers,"agents, supervisors, quality analysts",personality fit and communication skills,Industry
hiring-software-for-startups,/hiring-software-for-startups/,Hiring Software for Startups | SmoothHiring,"SmoothHiring helps startups businesses hire generalists, engineers, growth roles faster. Solve culture fit with limited HR resources with AI-powered recruitment.",Smarter Hiring Software for Startups,Startups,"generalists, engineers, growth roles",culture fit with limited HR resources,Industry
